{
  "foreverVersion": "0.1",
  "id": "capability.catalog",
  "kind": "capability",
  "name": "Persist and retrieve catalog",
  "statement": "Preserve identity, metadata and authority across retries and restart.",
  "relatedInvariants": [
    "invariant.catalog"
  ],
  "relatedImplementations": [
    "implementation.catalog"
  ],
  "provenance": {
    "sourceType": "agent-proposed",
    "sourceReference": "Source-aware producer preparation; independent construction NOT_RUN",
    "confidence": 1,
    "reviewStatus": "unreviewed"
  }
}
